{"affected_crates":["mesh-llm-host-runtime","mesh-llm"],"base_sha":"bbbbbbbbbbbbbbbbbbbbbbbbbbbbbbbbbbbbbbbb","budgets":{"linux_max_parallel":7,"macos_max_parallel":2,"total_max_workers":10,"windows_max_parallel":1},"cache_modes":{"product-smoke":"none","quality":"none","runtime-product":"pr-isolated","rust-tests":"pr-isolated","static-abi":"pr-isolated","ui-artifact":"pr-isolated"},"dependencies":{"product-smoke":["runtime-product"],"quality":[],"runtime-product":["ui-artifact"],"rust-tests":["static-abi"],"static-abi":[],"ui-artifact":[]},"direct_crates":["mesh-llm-host-runtime"],"domains":["rust","runtime-product"],"event_name":"pull_request","matrices":{"clippy":[{"crates":["mesh-llm-host-runtime"],"id":"batch-0","idx":0,"weight":10},{"crates":["mesh-llm"],"id":"batch-1","idx":1,"weight":10}],"hosts":[{"architecture":"amd64","id":"linux-amd64-host","platform":"linux","profile":"ci","runner_role":"linux-build-8"}],"platform_checks":[],"runtime_products":[{"architecture":"amd64","backend":"cpu","build_dir":".deps/llama.cpp/build-stage-abi-dynamic-cpu","container_image":"ghcr.io/mesh-llm/mesh-llm-cuda-runner@sha256:f499b79bc52dc7492d57397fdbec9f890c6f6bb1d8c1fcde9c1c97d45c0541a7","id":"linux-cpu","platform":"linux","profile":"ci","runner_role":"linux-build-8","target":"x86_64-unknown-linux-gnu","toolchain_epoch":"mesh-llm-cuda-runner-sha256-f499b79bc52dc7492d57397fdbec9f890c6f6bb1d8c1fcde9c1c97d45c0541a7","verify_backend":"public"}],"rust_tests":[{"crates":["mesh-llm-host-runtime"],"id":"batch-0","idx":0,"weight":10},{"crates":["mesh-llm"],"id":"batch-1","idx":1,"weight":10}],"sdk":[],"smoke":[{"backend":"cpu","id":"core","kind":"core","platform":"linux","runner_role":"linux-build-4"},{"id":"two-node-client","kind":"two-node-client","runner_role":"linux-build-4"},{"id":"two-node-split","kind":"two-node-split","runner_role":"linux-build-8"}]},"profile":"pr-ready","reasons":{"product-smoke":["domain:runtime-product"],"quality":["profile:base"],"runtime-product":["domain:runtime-product"],"rust-tests":["domain:runtime-product","domain:rust"],"static-abi":["dependency:rust-tests"],"ui-artifact":["dependency:runtime-product"]},"required_slices":["quality","ui-artifact","static-abi","rust-tests","runtime-product","product-smoke"],"runner_roles":{"product-smoke":"linux-build-4","quality":"linux-plan","runtime-product":"linux-native-16","rust-tests":"linux-build-8","static-abi":"linux-native-16","ui-artifact":"linux-build-4"},"schema_version":1,"signals":{"backend_changed":true,"cli_surface_changed":false,"docs_only":false,"plugin_exemplars_changed":false,"runner_contract_required":false,"rust_changed":true,"ui_changed":false,"website_changed":false,"website_docs_changed":false},"source_sha":"aaaaaaaaaaaaaaaaaaaaaaaaaaaaaaaaaaaaaaaa"}