{"affected_crates":["mesh-llm"],"base_sha":"bbbbbbbbbbbbbbbbbbbbbbbbbbbbbbbbbbbbbbbb","budgets":{"linux_max_parallel":7,"macos_max_parallel":2,"total_max_workers":10,"windows_max_parallel":1},"cache_modes":{"product-smoke":"none","quality":"none","runtime-product":"pr-isolated","ui-artifact":"pr-isolated"},"dependencies":{"product-smoke":["runtime-product"],"quality":[],"runtime-product":["ui-artifact"],"ui-artifact":[]},"direct_crates":[],"domains":["tooling","backend-cuda"],"event_name":"pull_request","matrices":{"clippy":[],"hosts":[{"architecture":"amd64","id":"linux-amd64-host","platform":"linux","profile":"ci","runner_role":"linux-native-16"},{"architecture":"amd64","id":"windows-amd64-host","platform":"windows","profile":"ci","runner_role":"windows-build"}],"platform_checks":[],"runtime_products":[{"architecture":"amd64","backend":"cuda","build_dir":".deps/llama-build/build-stage-abi-dynamic-cuda-sm86-sm120","container_image":"ghcr.io/mesh-llm/mesh-llm-cuda-runner@sha256:6389ee2ae23c116b60fd1de61c1e67308ddabf50c274e7f1963b1a2d89b383e4","cuda_architectures":"86;120","cuda_version":"12.9.2","id":"linux-cuda","platform":"linux","profile":"ci","runner_role":"linux-native-16","target":"x86_64-unknown-linux-gnu","toolchain_epoch":"mesh-llm-cuda-runner-sha256-6389ee2ae23c116b60fd1de61c1e67308ddabf50c274e7f1963b1a2d89b383e4","verify_backend":"public cuda"},{"architecture":"amd64","backend":"cuda","build_dir":".deps/llama-build/windows/build-stage-abi-cuda","cuda_architectures":"75","id":"windows-cuda","platform":"windows","profile":"ci","runner_role":"windows-build","target":"x86_64-pc-windows-msvc"}],"rust_tests":[],"sdk":[],"smoke":[{"backend":"cuda","id":"core-cuda","kind":"core","platform":"linux","runner_role":"gpu-nvidia"}]},"profile":"pr-ready","reasons":{"product-smoke":["domain:backend-cuda"],"quality":["domain:tooling","profile:base"],"runtime-product":["domain:backend-cuda"],"ui-artifact":["dependency:runtime-product"]},"required_slices":["quality","ui-artifact","runtime-product","product-smoke"],"runner_roles":{"product-smoke":"linux-build-4","quality":"linux-plan","runtime-product":"linux-native-16","ui-artifact":"linux-build-4"},"schema_version":1,"signals":{"backend_changed":true,"cli_surface_changed":false,"docs_only":false,"plugin_exemplars_changed":false,"runner_contract_required":false,"rust_changed":false,"ui_changed":false,"website_changed":false,"website_docs_changed":false},"source_sha":"aaaaaaaaaaaaaaaaaaaaaaaaaaaaaaaaaaaaaaaa"}