{"affected_crates":[],"base_sha":"bbbbbbbbbbbbbbbbbbbbbbbbbbbbbbbbbbbbbbbb","budgets":{"linux_max_parallel":7,"macos_max_parallel":2,"total_max_workers":10,"windows_max_parallel":1},"cache_modes":{"runner-contract":"none"},"dependencies":{"runner-contract":[]},"direct_crates":[],"domains":["ci-control","docs"],"event_name":"pull_request","matrices":{"clippy":[],"hosts":[],"platform_checks":[],"runtime_products":[],"rust_tests":[],"sdk":[],"smoke":[]},"profile":"pr-draft","reasons":{"runner-contract":["domain:ci-control"]},"required_slices":["runner-contract"],"runner_roles":{"runner-contract":"linux-plan"},"schema_version":1,"signals":{"backend_changed":false,"cli_surface_changed":false,"docs_only":true,"plugin_exemplars_changed":false,"runner_contract_required":true,"rust_changed":false,"ui_changed":false,"website_changed":false,"website_docs_changed":false},"source_sha":"aaaaaaaaaaaaaaaaaaaaaaaaaaaaaaaaaaaaaaaa"}