{"affected_crates":["mesh-llm","mesh-llm-host-runtime","mesh-native-serving-plugin-host","skippy-server","skippy-metrics","mesh-llm-sdk","mesh-llm-embedded-runtime","mesh-llm-ffi","mesh-llm-nodejs","metrics-server"],"base_sha":"bbbbbbbbbbbbbbbbbbbbbbbbbbbbbbbbbbbbbbbb","budgets":{"linux_max_parallel":7,"macos_max_parallel":2,"total_max_workers":10,"windows_max_parallel":1},"cache_modes":{"quality":"none","rust-tests":"pr-isolated","static-abi":"pr-isolated"},"dependencies":{"quality":[],"rust-tests":["static-abi"],"static-abi":[]},"direct_crates":["skippy-metrics"],"domains":["rust"],"event_name":"pull_request","matrices":{"clippy":[{"crates":["mesh-llm","mesh-native-serving-plugin-host","mesh-llm-sdk","mesh-llm-nodejs"],"id":"batch-0","idx":0,"weight":13},{"crates":["mesh-llm-host-runtime","skippy-metrics","mesh-llm-ffi","metrics-server"],"id":"batch-1","idx":1,"weight":13},{"crates":["mesh-llm-embedded-runtime","skippy-server"],"id":"batch-2","idx":2,"weight":13}],"hosts":[],"platform_checks":[],"runtime_products":[],"rust_tests":[{"crates":["mesh-llm"],"id":"batch-0","idx":0,"weight":10},{"crates":["mesh-llm-host-runtime"],"id":"batch-1","idx":1,"weight":10},{"crates":["mesh-llm-embedded-runtime","mesh-llm-ffi","metrics-server"],"id":"batch-2","idx":2,"weight":10},{"crates":["skippy-server","mesh-native-serving-plugin-host","skippy-metrics","mesh-llm-sdk","mesh-llm-nodejs"],"id":"batch-3","idx":3,"weight":9}],"sdk":[],"smoke":[]},"profile":"pr-ready","reasons":{"quality":["profile:base"],"rust-tests":["domain:rust"],"static-abi":["dependency:rust-tests"]},"required_slices":["quality","static-abi","rust-tests"],"runner_roles":{"quality":"linux-plan","rust-tests":"linux-build-8","static-abi":"linux-native-16"},"schema_version":1,"signals":{"backend_changed":false,"cli_surface_changed":false,"docs_only":false,"plugin_exemplars_changed":false,"runner_contract_required":false,"rust_changed":true,"ui_changed":false,"website_changed":false,"website_docs_changed":false},"source_sha":"aaaaaaaaaaaaaaaaaaaaaaaaaaaaaaaaaaaaaaaa"}