{"affected_crates":["mesh-llm"],"base_sha":"bbbbbbbbbbbbbbbbbbbbbbbbbbbbbbbbbbbbbbbb","budgets":{"linux_max_parallel":7,"macos_max_parallel":2,"total_max_workers":10,"windows_max_parallel":1},"cache_modes":{"platform-checks":"none","product-smoke":"none","quality":"none","runtime-product":"pr-isolated","rust-tests":"pr-isolated","static-abi":"pr-isolated","ui-artifact":"pr-isolated"},"dependencies":{"platform-checks":[],"product-smoke":["runtime-product"],"quality":[],"runtime-product":["ui-artifact"],"rust-tests":["static-abi"],"static-abi":[],"ui-artifact":[]},"direct_crates":[],"domains":["tooling","runtime-product","platform-macos"],"event_name":"pull_request","matrices":{"clippy":[],"hosts":[{"architecture":"amd64","id":"linux-amd64-host","platform":"linux","profile":"ci","runner_role":"linux-build-8"},{"architecture":"arm64","id":"macos-arm64-host","platform":"macos","profile":"ci","runner_role":"macos-build"}],"platform_checks":[{"architecture":"arm64","id":"macos-portable","kind":"portable","platform":"macos","runner_role":"macos-build"},{"architecture":"arm64","id":"macos-unit","kind":"unit","platform":"macos","runner_role":"macos-build"}],"runtime_products":[{"architecture":"amd64","backend":"cpu","build_dir":".deps/llama.cpp/build-stage-abi-dynamic-cpu","container_image":"ghcr.io/mesh-llm/mesh-llm-cuda-runner@sha256:f499b79bc52dc7492d57397fdbec9f890c6f6bb1d8c1fcde9c1c97d45c0541a7","id":"linux-cpu","platform":"linux","profile":"ci","runner_role":"linux-build-8","target":"x86_64-unknown-linux-gnu","toolchain_epoch":"mesh-llm-cuda-runner-sha256-f499b79bc52dc7492d57397fdbec9f890c6f6bb1d8c1fcde9c1c97d45c0541a7","verify_backend":"public"},{"architecture":"arm64","backend":"metal","build_dir":".deps/llama-build/build-stage-abi-dynamic-metal","id":"macos-metal","platform":"macos","profile":"ci","runner_role":"macos-build","target":"aarch64-apple-darwin"}],"rust_tests":[{"crates":["mesh-llm"],"id":"batch-0","idx":0,"weight":10}],"sdk":[],"smoke":[{"backend":"cpu","id":"core","kind":"core","platform":"linux","runner_role":"linux-build-4"},{"id":"two-node-client","kind":"two-node-client","runner_role":"linux-build-4"},{"id":"two-node-split","kind":"two-node-split","runner_role":"linux-build-8"},{"id":"metal-model-load","kind":"metal-model-load","runner_role":"macos-build"}]},"profile":"pr-ready","reasons":{"platform-checks":["domain:platform-macos"],"product-smoke":["domain:platform-macos","domain:runtime-product"],"quality":["domain:tooling","profile:base"],"runtime-product":["domain:platform-macos","domain:runtime-product"],"rust-tests":["domain:runtime-product"],"static-abi":["dependency:rust-tests"],"ui-artifact":["dependency:runtime-product"]},"required_slices":["quality","ui-artifact","static-abi","rust-tests","runtime-product","platform-checks","product-smoke"],"runner_roles":{"platform-checks":"platform-build","product-smoke":"linux-build-4","quality":"linux-plan","runtime-product":"linux-native-16","rust-tests":"linux-build-8","static-abi":"linux-native-16","ui-artifact":"linux-build-4"},"schema_version":1,"signals":{"backend_changed":true,"cli_surface_changed":false,"docs_only":false,"plugin_exemplars_changed":false,"runner_contract_required":false,"rust_changed":false,"ui_changed":false,"website_changed":false,"website_docs_changed":false},"source_sha":"aaaaaaaaaaaaaaaaaaaaaaaaaaaaaaaaaaaaaaaa"}