{"affected_crates":["mesh-llm","mesh-llm-host-runtime","mesh-llm-config"],"base_sha":"","budgets":{"linux_max_parallel":12,"macos_max_parallel":4,"total_max_workers":18,"windows_max_parallel":2},"cache_modes":{"model-download":"none","platform-checks":"none","product-smoke":"none","quality":"none","runner-contract":"none","runtime-product":"trusted-readonly","rust-tests":"trusted-readonly","sdk":"trusted-readonly","static-abi":"trusted-readonly","ui-artifact":"trusted-readonly","web":"trusted-readonly"},"dependencies":{"model-download":[],"platform-checks":[],"product-smoke":["runtime-product"],"quality":[],"runner-contract":[],"runtime-product":["ui-artifact"],"rust-tests":["static-abi"],"sdk":["runtime-product"],"static-abi":[],"ui-artifact":[],"web":[]},"direct_crates":[],"domains":["ci-control"],"event_name":"workflow_dispatch","matrices":{"clippy":[{"crates":["mesh-llm"],"id":"batch-0","idx":0,"weight":10},{"crates":["mesh-llm-host-runtime"],"id":"batch-1","idx":1,"weight":10},{"crates":["mesh-llm-config"],"id":"batch-2","idx":2,"weight":1}],"hosts":[{"architecture":"amd64","id":"linux-amd64-host","platform":"linux","profile":"ci","runner_role":"linux-build-8"},{"architecture":"arm64","id":"macos-arm64-host","platform":"macos","profile":"ci","runner_role":"macos-build"},{"architecture":"amd64","id":"windows-amd64-host","platform":"windows","profile":"ci","runner_role":"windows-build"}],"platform_checks":[{"architecture":"arm64","id":"macos-portable","kind":"portable","platform":"macos","runner_role":"macos-build"},{"architecture":"arm64","id":"macos-unit","kind":"unit","platform":"macos","runner_role":"macos-build"},{"architecture":"amd64","id":"windows-portable","kind":"portable","platform":"windows","runner_role":"windows-build"},{"architecture":"amd64","id":"windows-unit","kind":"unit","platform":"windows","runner_role":"windows-build"},{"architecture":"amd64","id":"windows-log-store","kind":"log-store","platform":"windows","runner_role":"windows-build"}],"runtime_products":[{"architecture":"amd64","backend":"cpu","build_dir":".deps/llama.cpp/build-stage-abi-dynamic-cpu","container_image":"ghcr.io/mesh-llm/mesh-llm-cuda-runner@sha256:f499b79bc52dc7492d57397fdbec9f890c6f6bb1d8c1fcde9c1c97d45c0541a7","id":"linux-cpu","platform":"linux","profile":"ci","runner_role":"linux-build-8","target":"x86_64-unknown-linux-gnu","toolchain_epoch":"mesh-llm-cuda-runner-sha256-f499b79bc52dc7492d57397fdbec9f890c6f6bb1d8c1fcde9c1c97d45c0541a7","verify_backend":"public"},{"architecture":"amd64","backend":"cuda","build_dir":".deps/llama-build/build-stage-abi-dynamic-cuda-sm86-sm120","container_image":"ghcr.io/mesh-llm/mesh-llm-cuda-runner@sha256:6389ee2ae23c116b60fd1de61c1e67308ddabf50c274e7f1963b1a2d89b383e4","cuda_architectures":"86;120","cuda_version":"12.9.2","id":"linux-cuda","platform":"linux","profile":"ci","runner_role":"linux-native-16","target":"x86_64-unknown-linux-gnu","toolchain_epoch":"mesh-llm-cuda-runner-sha256-6389ee2ae23c116b60fd1de61c1e67308ddabf50c274e7f1963b1a2d89b383e4","verify_backend":"public cuda"},{"architecture":"amd64","backend":"rocm","build_dir":".deps/llama-build/build-stage-abi-dynamic-rocm-gfx1100","container_image":"ghcr.io/mesh-llm/mesh-llm-cuda-runner@sha256:1bae8081975edf3f876e143c78a15464643d0192312a42fba9816c3f828ca005","id":"linux-rocm","platform":"linux","profile":"ci","rocm_architectures":"gfx1100","runner_role":"linux-native-16","target":"x86_64-unknown-linux-gnu","toolchain_epoch":"mesh-llm-cuda-runner-sha256-1bae8081975edf3f876e143c78a15464643d0192312a42fba9816c3f828ca005","verify_backend":"public rocm"},{"architecture":"amd64","backend":"vulkan","build_dir":".deps/llama-build/build-stage-abi-dynamic-vulkan","container_image":"ghcr.io/mesh-llm/mesh-llm-cuda-runner@sha256:08439af08af125c82c25c32cbcd385e07a783ba8d9b7c19157e93089e349156e","id":"linux-vulkan","platform":"linux","profile":"ci","runner_role":"linux-native-16","target":"x86_64-unknown-linux-gnu","toolchain_epoch":"mesh-llm-cuda-runner-sha256-08439af08af125c82c25c32cbcd385e07a783ba8d9b7c19157e93089e349156e","verify_backend":"public vulkan"},{"architecture":"arm64","backend":"metal","build_dir":".deps/llama-build/build-stage-abi-dynamic-metal","id":"macos-metal","platform":"macos","profile":"ci","runner_role":"macos-build","target":"aarch64-apple-darwin"},{"architecture":"amd64","backend":"cpu","build_dir":".deps/llama-build/windows/build-stage-abi-cpu","id":"windows-cpu","platform":"windows","profile":"ci","runner_role":"windows-build","target":"x86_64-pc-windows-msvc"},{"architecture":"amd64","backend":"cuda","build_dir":".deps/llama-build/windows/build-stage-abi-cuda","cuda_architectures":"75","id":"windows-cuda","platform":"windows","profile":"ci","runner_role":"windows-build","target":"x86_64-pc-windows-msvc"},{"architecture":"amd64","backend":"rocm","build_dir":".deps/llama-build/windows/build-stage-abi-rocm","id":"windows-rocm","platform":"windows","profile":"ci","rocm_architectures":"gfx1100","runner_role":"windows-build","target":"x86_64-pc-windows-msvc"},{"architecture":"amd64","backend":"vulkan","build_dir":".deps/llama-build/windows/build-stage-abi-vulkan","id":"windows-vulkan","platform":"windows","profile":"ci","runner_role":"windows-build","target":"x86_64-pc-windows-msvc"}],"rust_tests":[{"crates":["mesh-llm"],"id":"batch-0","idx":0,"weight":10},{"crates":["mesh-llm-host-runtime"],"id":"batch-1","idx":1,"weight":10},{"crates":["mesh-llm-config"],"id":"batch-2","idx":2,"weight":1}],"sdk":[{"architecture":"amd64","id":"rust","language":"rust","platform":"linux","runner_role":"linux-build-4"},{"architecture":"amd64","id":"kotlin","language":"kotlin","platform":"linux","runner_role":"linux-build-8"},{"architecture":"arm64","id":"swift","language":"swift","platform":"macos","runner_role":"macos-build"}],"smoke":[{"backend":"cpu","id":"core","kind":"core","platform":"linux","runner_role":"linux-build-4"},{"backend":"cuda","id":"core-cuda","kind":"core","platform":"linux","runner_role":"gpu-nvidia"},{"id":"two-node-client","kind":"two-node-client","runner_role":"linux-build-4"},{"id":"two-node-split","kind":"two-node-split","runner_role":"linux-build-8"},{"id":"model-download","kind":"model-download","runner_role":"linux-build-4"},{"id":"metal-model-load","kind":"metal-model-load","runner_role":"macos-build"}]},"profile":"manual-full","reasons":{"model-download":["control-plane:fail-open","profile:base"],"platform-checks":["control-plane:fail-open","profile:base"],"product-smoke":["control-plane:fail-open","profile:base"],"quality":["control-plane:fail-open","profile:base"],"runner-contract":["control-plane:fail-open","domain:ci-control","profile:base"],"runtime-product":["control-plane:fail-open","profile:base"],"rust-tests":["control-plane:fail-open","profile:base"],"sdk":["control-plane:fail-open","profile:base"],"static-abi":["control-plane:fail-open","profile:base"],"ui-artifact":["control-plane:fail-open","profile:base"],"web":["control-plane:fail-open","profile:base"]},"required_slices":["quality","web","ui-artifact","static-abi","rust-tests","runtime-product","platform-checks","product-smoke","model-download","sdk","runner-contract"],"runner_roles":{"model-download":"linux-build-4","platform-checks":"platform-build","product-smoke":"linux-build-4","quality":"linux-plan","runner-contract":"linux-plan","runtime-product":"linux-native-16","rust-tests":"linux-build-8","sdk":"platform-build","static-abi":"linux-native-16","ui-artifact":"linux-build-4","web":"linux-plan"},"schema_version":1,"signals":{"backend_changed":true,"cli_surface_changed":true,"docs_only":false,"plugin_exemplars_changed":true,"runner_contract_required":true,"rust_changed":true,"ui_changed":true,"website_changed":true,"website_docs_changed":true},"source_sha":"aaaaaaaaaaaaaaaaaaaaaaaaaaaaaaaaaaaaaaaa"}