{"affected_crates":[],"base_sha":"bbbbbbbbbbbbbbbbbbbbbbbbbbbbbbbbbbbbbbbb","budgets":{"linux_max_parallel":7,"macos_max_parallel":2,"total_max_workers":10,"windows_max_parallel":1},"cache_modes":{"quality":"none"},"dependencies":{"quality":[]},"direct_crates":[],"domains":[],"event_name":"pull_request","matrices":{"clippy":[],"hosts":[],"platform_checks":[],"runtime_products":[],"rust_tests":[],"sdk":[],"smoke":[]},"profile":"pr-ready","reasons":{"quality":["profile:base"]},"required_slices":["quality"],"runner_roles":{"quality":"linux-plan"},"schema_version":1,"signals":{"backend_changed":false,"cli_surface_changed":false,"docs_only":false,"plugin_exemplars_changed":false,"runner_contract_required":false,"rust_changed":false,"ui_changed":false,"website_changed":false,"website_docs_changed":false},"source_sha":"aaaaaaaaaaaaaaaaaaaaaaaaaaaaaaaaaaaaaaaa"}